Наименование товара;Средний рейтинг;Остаток на складе;Продажи;В избранном
Плавающая игрушка для домашних животных из ЭВА, устойчивая к укусам и не оставляющая следов, летающая игрушка для дрессировки собак, товары для чувствительных питомцев.;5,0;16;35;7
Игрушка для кошек: красочный мячик ручной работы, интерактивная игрушка для кошек, плюшевый набор игрушек для кошек, интерактивные мини-игрушки для домашних животных.;4,7;558;43;11
Кровать для собак, кошек и других домашних животных, квадратная плюшевая, для средних и маленьких собак, диван-кровать, подушка для успокаивающей лежанки для собак, домик для питомца, товары для животных, аксессуары;4,2;47863;85;191
Миниатюрная электрическая игрушка-жучок для собак и кошек, интерактивная милая божья коровка в форме животного, игрушка для кошек в виде ходячего насекомого, принадлежности для игр с кошками.;4,6;624;2000;970
Новые резинки для ухода за шерстью собак, аксессуары для домашних животных, красочные товары для животных, эластичные заколки для шерсти, аксессуары для волос, 100 шт.;4,7;149990;35;177
Портативный биоразлагаемый диспенсер для пакетов для уборки собачьих экскрементов, держатель для пакетов для щенков и кошек, товары для животных, мусорные пакеты.;4,8;18;97;4386
Профессиональный триммер-бритва 2-в-1 для ухода за домашними животными (собаками и кошками) с 2 металлическими лезвиями для безопасного ухода.;4,8;6;60;72
Набор зубных щеток для животных, товары для домашних животных, зубная паста для собак, зубная щетка, набор для ухода за полостью рта для кошек и собак, набор зубных щеток-пальчиков Vanilla Beef C05;4,4;159910;46;79
Новый домик-палатка для кошек, теплая зимняя лежанка для кошек и собак, домик для глубокого сна для щенков и кошек, палатка для дома и улицы с подушкой, товары для животных.;4,9;3;44;123
Универсальная моторизованная щетка-распылитель 3 в 1 для кошек и собак: массажная щетка для груминга, удаления спутанной шерсти и выпадения волос. Товары для домашних животных.;5,0;423;22;2
Гигантский теннисный мяч для собак, 24 см, игрушка для жевания, забавный большой надувной теннисный мяч, товары для домашних животных, интерактивные игрушки для игр с собаками.;4,5;53;121;50
Палка для селфи для собак и кошек, инструменты для фотосъемки, игрушки для взаимодействия с животными, концентрированные средства для дрессировки, аксессуары для собак, дропшиппинг.;4,4;197;51;180
1 шт. Расческа для ухода за животными, двусторонняя расческа для больших собак, щетка для кошек и собак, деревянная мягкая щетка для удаления шерсти собак. Товары для собак.;4,5;1959;199;55
Ошейник и поводок для собак из карамельного вельвета с гравировкой на табличке. Товары для животных. Поводок для собак из вельвета.;4,9;27437;48;107
Электрощетка для кошек с функцией паровой обработки, электрический распылитель воды, расческа для котят, мягкая силиконовая щетка для депиляции, щетка для купания кошек, принадлежности для груминга.;4,7;29807;157;0
Забавный шлем для цыпленка, защитная кепка от солнца и дождя, аксессуары для мелких домашних животных, защитные принадлежности для мелких питомцев.;4,0;53;27;23
Ошейник для щенков «Цветок любви», плетеный вручную ошейник для кошек, шерстяной вязаный ошейник для кошек и собак, ожерелье для кошек и маленьких собак, ошейник для домашних животных, товары для животных.;4,7;85;197;1037
Натуральные безопасные съедобные игрушки для кошек с кошачьей мятой, мятный мячик для здоровой чистки зубов, палочка для чистки зубов, леденец для кошек с кошачьей мятой.;4,2;93;20;22
Лестницы для животных, лестницы для кошек и собак, 2/3 ступеньки, пандус, диван, щенок, старые собаки, нескользящая съемная лестница, вспомогательное средство для подъема, высокая лежанка для дивана, товары для животных.;4,9;208;155;195
10 шт. бантиков в форме цветка для ухода за шерстью собак, маленькие бантики для шерсти кошек и собак, аксессуары для шерсти животных, товары для животных;5,0;29;44;37
Туннель-гнездо для кошек, зимняя теплая съемная моющаяся лежанка, кошачий домик, закрытый домик, осенне-зимний коврик, товары для животных, аксессуары;4,4;212;138;1468
Игрушки для кошек, палочка-дразнилка для кошек, свободно выдвижная и заменяемая головка игрушки с пером, маленькая и гибкая, для кошек, мятный цвет, товары для животных.;4,9;13;140;459
Заколки для волос для собак и кошек, милые бантики, разноцветные расчески для волос, товары для щенков, аксессуары для волос для домашних животных.;5,0;9991;21;28
Игрушка для кошек, хомяков, хомячков, котят, игры, дразнящие интерактивные игрушки, аксессуары для охоты, царапания и укусов, товары для домашних кошек.;4,3;15;113;395
Кружевная бандана для собак с принтом, мягкий ошейник, аксессуар для домашних животных, шарф для кошек, цветочный бант для чихуахуа, щенка или котенка, поводок;3,9;10693;43;367
Металлическая круглая костяная табличка для собаки, предотвращающая потерю, с цветными надписями, металлический кулон-бирка для ошейника, аксессуары для домашних животных.;5,0;1053;88;142
Расчески для собачьей шерсти, расчески с открытыми узлами для собак, устройство для удаления шерсти кошек, специальная щетка для удаления шерсти собак и кошек, расческа с металлическими зубцами, товары для животных.;5,0;31;30;58
Силиконовая сумка для лакомств для собак, портативная поясная сумка для дрессировки собак, уличная кормушка, мешочек для перекусов щенка, сумка для хранения корма и поощрений для животных.;4,8;899;500;498
Подушка для домашних животных, теплая, для осенне-зимнего сезона, для собачьей будки, для кошек и собак, с принтом, нескользящая подушка для сиденья, товары для собак.;4,4;2;86;77
Модная заколка для волос в виде бабочки и бриллианта, ручная работа, зажим BB, заколка для волос, для длинношерстных кошек, мальтийских болонок, маленьких собак, в стиле принцессы, товары для домашних животных.;3,2;9991;23;47
Набор галстуков-бабочек для собак, для ухода за шерстью собак, для кошек и других домашних животных, оптовая продажа товаров для животных, 26 разных цветов.;4,9;14615;194;347
Товары для животных: ошейник для собак с пряжкой из сплава, цепочка для собак и кошек, регулируемый размер для маленьких и средних собак. Ошейники для собак.;4,8;526;307;557
Нейлоновый ошейник для собак со светодиодной подсветкой, ночной ошейник для безопасности домашних животных, ошейник для кошек и собак, светодиодные ошейники для маленьких собак, светящиеся аксессуары для домашних животных.;5,0;28;63;36421
Классическая клетчатая бандана-нагрудник для собак, треугольный головной платок для кошек, аксессуары, шейный платок для маленьких, средних и больших собак.;4,3;119217;41;272
Резиновый мячик для жевания для собак, пищащий, для чистки зубов, игрушка для собак, забавный мячик для жевания для собак, устойчивый к укусам, товары для животных;5,0;46;22;305
Комплект шлейки для собак, предотвращающей рывки, с поводком длиной 1,2 м, регулируемым размером, из ткани с принтом, для собак породы питбуль. Товары для домашних животных.;5,0;21;43;5166
Игрушки-головоломки для собак, интерактивная кормушка-стаканчик для корма для домашних животных, игрушка для щенков, диспенсер для лакомств и угощений для собак, товары для дрессировки собак с целью повышения интеллекта.;5,0;1;85;83
HOOPET Милая кошачья лежанка, теплый домик для питомца, пещерка для котят, подушка, комфортный домик-палатка для кошек, гнездо для щенков, коврик для маленьких собак, принадлежности для кошек;4,8;98;32;860
Милая розовая игрушка для домашних животных в виде поросенка, издающая писк, мягкая резиновая мини-игрушка для жевания, интерактивные игры, тренировка, забавная игрушка для домашних животных, 10 шт.;5,0;220;121;426
Двойная кормушка для кошек с регулируемой высотой, поилка для кошек, приподнятая миска для кормления котят, кормушки для собак.;5,0;9;34;114
Игрушки для собак, забавные игрушки-имитации мяса, игрушки для игр с щенками и другими домашними животными, жевательные игрушки, пищащие игрушки для маленьких и больших собак, мопсов и кошек. Товары для домашних животных.;4,8;78;30;481
15 видов цветных нейлоновых ошейников для собак с принтом, регулируемый ошейник для собак, товары для домашних животных, именная табличка с индивидуальной гравировкой, товары для животных;4,6;29751;178;3502
50 шт. Рождественские галстуки-бабочки для собак и кошек, регулируемые галстуки-бабочки для собак, праздничные ошейники-бабочки для домашних животных, принадлежности для ухода за шерстью маленьких собак.;5,0;900;23;27
Мягкая зубная щетка-палец для собак, средство для чистки зубов, средство от неприятного запаха изо рта, силиконовая щетка для чистки зубов кошек, принадлежности для чистки полости рта домашних животных.;4,7;77;2;3
Большая миска для собак из нержавеющей стали, миска для кормления и поения кошек и собак, металлическая миска для кормления, 9 размеров, товары для собак.;4,8;49;23;22
Двухслойный водонепроницаемый нескользящий коврик для кошачьего туалета из ЭВА, фильтр для песочницы, моющийся матрас для котят и собак, коврик для пола, принадлежности для уборки домашних животных.;4,8;35187;1000;3193
Зимний теплый коврик для домашних животных HOOPET, мягкий диванчик для маленьких и средних собак, съемная лежанка для кошек и собак, моющаяся пушистая лежанка для сна домашних животных.;5,0;198;18;67
Паровая щетка для кошек, массажная расческа для домашних животных, расческа для груминга кошек и собак, электрическая щетка для купания кошек, щетки для шерсти, принадлежности для груминга.;4,8;462;49;170
Набор из 3 зубных щеток для домашних животных: фиолетовая силиконовая щетка для кошек, устраняет неприятный запах изо рта, зубной камень, уход за зубами, чистка полости рта для собак и кошек.;5,0;33;75;253
Забавный шлем для курицы, маленькой птицы, утки, перепела, защитная каска, головной убор, предотвращающий травмирование головы курицы, защита головы для домашних животных.;3,7;44845;65;35
Поводок для собак MADDEN 3M 5M с автоматическим удлинением, изготовлен из прочного нейлона, подходит для прогулок с питомцами мелких и средних пород.;4,9;592;500;969
Персонализированные ошейники-бирки из нержавеющей стали для кошек и собак, аксессуары для гравировки на цепочке, принадлежности для именных жетонов для собак.;4,8;1094;154;349
Миски для корма для домашних животных имеют наклонное дно и защиту шеи, предотвращающую удушье у собак и кошек, а также высыпание корма.;5,0;39986;44;36
Портативный дезодорант для домашних животных, очиститель воздуха для дома, генератор отрицательных ионов для туалета, кошачьего лотка, чистящие средства для устранения запаха от домашних животных.;4,3;11;296;701
Электрощетка для паровой обработки шерсти собак и кошек, электрический распылитель воды, расческа для котят, мягкая силиконовая щетка для депиляции шерсти кошек, принадлежности для груминга.;4,6;1763;37;19
Автоматический дозатор кошачьего корма большой емкости, миска для питьевой воды, контейнер для сухого и влажного корма для собак.;4,5;2125;316;517
10 шт. Заколки для шерсти собак ручной работы, милые заколки с бантиками для маленьких собак, щенков и кошек, аксессуары для ухода за шерстью собак, товары для домашних животных;4,8;42;48;30
Утепленный фланелевый коврик для собак, мягкий спальный коврик для маленьких, средних и больших собак и кошек, теплое зимнее одеяло для домашних животных, товары для животных.;4,8;87;117;1850
10 шт. бантиков ручной работы для собак с бриллиантами и жемчугом, товары для домашних животных, бантики для шерсти животных, аксессуары для груминга щенков и маленьких собак.;4,7;427;125;1429
Летающий диск для собак, изготовленный из силикона, экологически чистый, не грызется, подходит для интерактивной дрессировки щенков и других домашних животных.;4,6;102;1000;608
Складная лежанка для кошек, домик для собак, зимняя вилла для кошек, спальный вольер, съемное теплое гнездо, закрытые палатки, пещера, диван, товары для животных.;4,6;4;62;201
1 шт. Роскошная золотая цепочка для собак, 53 см, регулируемая, модный кулон, металлический ошейник, аксессуары для домашних животных, реквизит для фотосессий с собаками.;4,9;6;63;368
Щетка для ухода за шерстью животных, щетка для груминга собак, средство для удаления шерсти домашних животных с длинной и короткой кудрявой шерсти у кошек, товары для животных, аксессуары для собак.;5,0;32;24;184
Супервпитывающие подгузники для собак, одноразовые подгузники-пеленки для дрессировки собак, здоровые подгузники-коврики для кошек и собак, коврики для клеток, товары для животных.;2,6;2362;41;498
Игрушка для жевания для собак, пищащий мячик для ухода за зубами, мультяшный монстр с большими глазами, интерактивная тренировочная игрушка из латекса для щенков и других домашних животных.;4,6;1994;86;156
Амортизирующая шлейка-жилет для собак, регулируемая светоотражающая шлейка для собак средних размеров, нагрудный ремень для прогулок с французским бульдогом, товары для животных.;4,6;587;52;91
Щетка-расческа для удаления шерсти собак и кошек, инструменты для ухода за домашними животными, триммер-расческа Cini Furmines для удаления шерсти собак и кошек, чистящие средства.;4,8;9;151;1335
Очки для собак, солнцезащитные очки для домашних животных, с регулируемым углом обзора, защита от УФ-излучения, защита глаз, товары для кошек и других домашних животных.;4,7;40;35;51
Регулируемая по ширине дверца для кошек, защелка в форме рыбы, быстросъемный гибкий ремешок-ограничитель для двери, товары для животных.;4,8;30;193;93
Персонализированный брелок-идентификатор для кошек и собак с бесплатной гравировкой имени питомца на ошейнике, шлейке или бирке для животных. Товары для животных.;4,6;22265;102;1291
Многоцветная прочная пластиковая лопатка для уборки кошачьего туалета, изготовленная в Китае из прочного материала для зоо;4,8;3980;23;15
Модные подушки для домашних животных 2019 года: подушки для сна кошек и собак, специальные подушки, подушки-мишки, товары для собак породы померанский шпиц, коврики для собак, подушки для щенков.;4,8;5940;137;1919
Складной домик-палатка для собак, портативный, с милым рисунком, мягкий коврик, прочная клетка для кошек, маленьких собак и щенков, палатки для животных.;4,3;224;22;34
Игрушка для собак «Рассыпание пролитой жидкости»: биомиметический ананас, интерактивная головоломка-карточка, корм для животных, мячик для животных, интерактивные игрушки для питомцев.;5,0;200;32;104
Удлинитель ремня безопасности для двух собак в автомобиле, светоотражающая полоса, регулируемый, аксессуар для путешествий в автомобиле, страховочный поводок для двух питомцев.;5,0;83;82;352
Протекающий корм, игрушечный мяч для собак, упражнения для развития рефлексов, инструмент для чихуахуа, развлекайте своего питомца развивающими игрушками, принадлежности для кормления плюшевых мишек.;4,7;44;52;27
