Наименование товара;Средний рейтинг;Остаток на складе;Продажи;В избранном
Новый гамак для кошек, качели из хлопковой веревки ручной работы, подвесная корзина для кошек и котят, подвесное гнездо для животных, товары для питомцев.;4,7;93;800;9184
Паровая щетка для собак, электрическая щетка-распылитель для кошачьей шерсти, щетка-пароочиститель 3 в 1 для массажа и ухода за домашними животными, удаления спутанной и выпавшей шерсти.;4,7;7852;322;115
Мягкие игрушки для домашних животных, издающие звуки, прочные и устойчивые к укусам, игрушки в виде лисы и белки.;4,6;3028;177;101
1 шт. Милая резиновая игрушка-поросенок со звуком хрюканья и писка из латекса для собак, пищалка, игрушки для дрессировки щенков, товары для домашних животных;4,6;42;317;106
Умные игрушки-мячики для кошек и котят с кошачьей мятой, коробка для хранения, автоматическая игра с волшебным мячиком, товары для домашних животных.;4,8;77;56;27
Высококачественная удлиненная стальная проволочная цепь для собак 5 мм*3 м, прочный двухсторонний поводок для собак с двумя металлическими крючками, товары для животных.;4,9;38;144;62
Набор чернил для создания отпечатков лап кошки и собаки. Безопасный, нетоксичный, подходит для создания отпечатков детских ножек, для новорожденного, для создания отпечатков рук. Легко сделать своими руками, не требует чернил, сувенир для питомца.;5,0;386;10;2
Силиконовый коврик для вылизывания животных, кормушка для кошек с присоской, подстилка для медленного кормления, подстилка для вылизывания собак, средства для снятия тревоги.;5,0;13;22;44
Супермягкая теплую утолщенную лежанку для собак и кошек, подходящая для маленьких и средних собак, нескользящий уютный коврик для сна кошек, будка для щенков и другие товары для животных.;5,0;6;30;157
Игрушки для кошек: интерактивный стрелялка, плюшевый мячик-дразнилка, развивающие игры для питомцев, мини-помпоны для кошек, товары для котят.;4,9;77;46;23
Держатель для пакетов для собачьих экскрементов, зажим для переноски отходов домашних животных, диспенсер для пакетов на поводке для собак, удобный для прогулок на открытом воздухе, для удобной переноски.;4,8;92;180;85
10 шт. галстуков для собак ко Дню Святого Патрика, товары для домашних животных, галстуки-бабочки для собак и кошек, белые и зеленые галстуки-бабочки для собак.;5,0;93;7;1
Товары для животных: миски для кормления собак и кошек, предотвращающие удушье, миски для замедления приема пищи у щенков, миски для предотвращения ожирения. Новинка! Разнообразие ;5,0;20;30;28
Интерактивные забавные игрушки для кошек, имитирующие жесты, миниатюрные, с различными стилями дразнения, пластиковые пальцы, имитация человеческих рук, перчатки, игрушки для домашних животных.;4,1;240;161;66
Забавные резиновые мячики для собак, мячики для жевания, прыгающие, твердые, для маленьких и больших собак. Игрушки для метания на открытом воздухе, тренировочные игрушки.;4,7;13;25;1
Латексные игрушки для собак со звуком пищащего слона и коровы, жевательные резиновые игрушки для маленьких и больших собак, устойчивые к укусам, интерактивные игрушки.;4,8;74;180;54
Набор из 3 зубных щеток для чистки зубов пальцами, зубная щетка для чистки полости рта, зубная щетка для домашних животных, товары для собак и животных.;4,7;27;78;14
Мягкие игрушки для собак из серии «Тропическое море»: кальмар/морской конек/акула/краб, пищащие игрушки для маленьких и больших собак, щенков и питомцев, аксессуары для дрессировки.;4,9;142;94;296
Новый выдвижной поводок для собак с ремешком на запястье, позволяющий освободить руки, автоматический браслет для поводка для питомца, регулируемый поводок для прогулок, аксессуары и принадлежности.;4,9;12;123;135
Интерактивная игрушка-мельница для кошек, игрушка-головоломка для кошек с вращающейся подставкой для котят, чистка зубов, товары для домашних животных.;4,4;1884;280;6962
10 шт. хлопковых бантиков для собак, красная серия, бантики для шерсти домашних животных, модные бантики для щенков, аксессуары для ухода за шерстью кошек и собак.;4,8;87;21;13
Портативная лопатка для песка для использования в помещении, прочный пластик, практичная лопатка для уборки кошачьего туалета, большие лопатки для товаров для животных.;4,3;37;33;21
Новый держатель для пакетов для уборки за домашними животными 2021 года, с фиксатором и удобным зажимом для выгула собак, а также диспенсер для пакетов для уборки за кошками и собаками.;4,9;291;199;256
Интерактивные обучающие игрушки для кошек, креативные мини-помпоны для котят, игры с растягивающимися плюшевыми мячиками, товары для кошек, аксессуары для домашних животных.;4,8;298;2000;12910
Регулируемый автомобильный ремень безопасности для собак, поводок, ошейник для собак с нейлоновым ремнем безопасности для поездок в автомобиле, аксессуары для собак.;4,7;586;14;3
Забавная интерактивная игрушка для кошек, игрушка-дразнилка для дрессировки, летающий диск, вращающийся гироскоп, игра-запуск, товары для домашних животных, игрушки для собак.;4,6;55;54;12
Портативная поилка для собак, дорожная поилка для домашних животных, герметичная миска для корма для собак, фонтанчик для кошек, уличная поилка для прогулок с собаками.;4,9;5865;110;193
120 рулонов пакетов для собачьих экскрементов, пакеты для уборки экскрементов на открытом воздухе, товары для домашних животных, 15 пакетов/рулон, сменные мусорные пакеты, товары для животных;4,8;10666;148;41
Игрушка для кошек: деревянная палочка в форме милого животного, мягкая палочка с колокольчиком, интерактивные забавные товары для домашних животных.;4,6;36;268;177
Массажная расческа для шерсти животных, предотвращающая образование узелков, с отсоединяемым лезвием из нержавеющей стали, для собак и кошек, расческа-щетка для груминга, инструменты для ухода за животными, зоомагазин.;5,0;48;14;1
Высококачественный набор инструментов для удаления блох и клещей из нержавеющей стали: крючок для царапания, пинцет, зажимы для кошек и собак. Принадлежности для ухода за домашними животными.;5,0;71;38;47
Мягкие резиновые игрушки для жевания, прочные, синие, для тренировки коренных зубов, забавный мячик для чихуахуа и йоркширского терьера, интерактивная косточка, лакомство, товары для животных;2,6;1046;37;24
Игрушки для кошек, развлекательная игрушка для кошек, вращающийся столик для кошек, мячик для кошек, палочка для кошек, автоматическая игрушка для кошек, товары для домашних животных.;5,0;5984;16;16
Складная силиконовая миска для собак и домашних животных объемом 350 мл, портативный контейнер для корма щенков для путешествий и отдыха на природе. Посуда для кормления домашних животных.;5,0;44;6;1
Большая лежанка для собак, теплый домик, квадратное гнездо конфетных цветов, будка для маленьких, средних и больших собак, кошек, щенков и собак больших размеров.;4,7;92;15;8
Диспенсер для пакетов для уборки собачьих экскрементов, портативный держатель для пакетов для собачьих отходов, органайзер для мусорных пакетов для домашних животных на открытом воздухе.;4,8;19;88;51
Набор игрушек для домашних животных: набор игрушек для кошек с мятой, плюшевая игрушка для котенка с кошачьей мятой и ароматом, мини-игрушка для жевания с кошачьей мятой, игрушка для измельчения зубов. Товары для домашних животных.;4,8;522;500;505
4 разноцветных интерактивных мячика из сизаля для кошек, игрушки для домашних животных, перьевая тренировочная палочка для кошек, аксессуары для кошек, мячик случайного цвета.;4,8;5;191;67
1 шт. Диспенсер для мусорных пакетов для домашних животных в форме стула, силиконовый, для кошек и собак, с застежкой, портативный, для хранения пакетов для туалета, принадлежности для собак.;5,0;189;12;7
Дышащий намордник для собак крупных пород, предотвращающий укусы, лай и жевание. Подходит для грейхаундов, зелёных уиппетов и других пород.;4,7;387;900;2676
Cat Toy Pet Cat Kitten Play Mouse Rat Mice Ball Cage Toys Pet Supplies Random Color аксессуары для кошек;4,5;10;11;1
Автоматическая кормушка-поилка для домашних животных объемом 3,5 л, миска для кормления и поения кошек, аксессуары для собак и кошек.;4,7;35;83;91
Behogar Novelty Stretchable Design Pet Dog Cat Training Clicker Agility Clickers Bird Whistle Commander Supply Accessory;4,7;3718;127;891
Модный ошейник для собак с чехлом Apple Air tag, нейлоновый светоотражающий мягкий ошейник для собак, защита от потери, отслеживающий ошейник, товары для собак, подходит для собак;4,6;6;128;151
1 шт. Прочная игрушка для домашних животных: веревочный узелок, жевательная игрушка для собак и кошек, интерактивная чистка зубов, товары для собак, цвет случайный.;4,7;27;473;156
Автоматический выдвижной поводок для собак, регулируемый поводок, товары для животных, поводок для выгула собак, разноцветное устройство для сцепления с поверхностью.;4,9;9947;39;14
6 рулонов, 90  пакетов для собачьих экскрементов, товары для домашних животных, пакеты для кошачьих и собачьих экскрементов, биоразлагаемые пакеты для уборки дома и улицы, мусорные пакеты;4,5;487;13;9
Пакет для собачьих экскрементов, биоразлагаемый, экологичный, компостируемый, одноразовый, из кукурузного крахмала, с ароматизатором, безопасный для здоровья.;1,0;418;35;17
Новые заколки для шерсти собак 2023 года: розовые заколки в форме цветка и сердца с бантиком, милые украшения для щенков, бантики для шерсти маленьких собак, аксессуары для головы домашних животных.;4,3;248;50;21
5 шт. Забавные плюшевые палочки-дразнилки для кошек, веревочка с колокольчиками, игрушка-ловушка для котят, интерактивная игрушка для домашних животных.;5,0;9;37;11
Идентификационная бирка для кошек и собак, противоутерянная, для ошейника, металлический кулон, бирка для животных, большие/маленькие животные.;5,0;1079;17;5
Супермягкая зубная щетка-палец для собак и кошек, средство для чистки зубов, предотвращает неприятный запах изо рта, нетоксичная силиконовая зубная щетка для собак и кошек.;5,0;156;26;16
Ультразвуковой отпугиватель собак со светодиодным фонариком, устройство для дрессировки и преследования животных, двухголовое устройство против лая, товары для собак породы немецкая овчарка.;4,5;6;19;5
7 цветов, силиконовая летающая тарелка, забавная игрушка для собак и кошек, игра для собак, летающие диски, устойчивые к жеванию, интерактивные товары для дрессировки щенков.;4,5;492;153;32
Очень мягкая кошачья лежанка, корзинка для домашних животных, кошачий домик-диван, шезлонг для маленьких собак, подушка для котят, пещера, коврик для щенков, домик-палатка, принадлежности для кошек.;4,8;29311;500;845
Игрушка-веревка с двойным узлом для жевания, чистка зубов, прочная плетеная костяная веревка, игрушка для восстановления зубов, товары для животных.;4,8;471;182;61
1 шт. Игрушки для кошек, палочка для жевания Silvervine, Polygonum, рафия, товары для домашних животных, палочка для чистки зубов, игрушка для кошек, конопляная веревка;4,7;98;1;1
1 комплект регулируемых подставок для ушей собак, инструмент для ухода за ушами, подставка для ушей для собак породы самоед или доберман, универсальный товар для домашних животных.;5,0;4;28;17
Радужный мячик для кошек, полосатая палочка для кошек, сменные перья для головы, аксессуары, колокольчик, интерактивные товары для кошек и кошек.;4,8;174;600;217
Диван-кровать для собак, большая лежанка для маленьких, средних и крупных собак, коврики, скамейка-шезлонг, лежанка для кошек, чихуахуа, щенков, будка для кошек, домик для домашних животных.;4,7;53043;6;6154
Перчатки для массажа ванны, щетка для щенков и больших собак/кошек, мягкие защитные силиконовые аксессуары для домашних животных (собак и кошек), инструменты Mascotas Products.;4,7;242;500;323
Складная портативная миска для домашних животных из силикона с крючком для подвешивания, миска для кошек и собак, товары для домашних животных, миска для собачьего корма Mascotas;4,6;630;137;25
Игрушки для собак, хлопковые веревочные тапочки для домашних животных, игрушки, издающие звуки, игрушки для чистки зубов собак, встроенная подушка безопасности, круглый мяч, колокольчик, различные;4,7;48;424;280
Мягкие плюшевые игрушки для собак: кричащая курица, забавная интерактивная пищащая игрушка для маленьких и больших собак.;5,0;4;61;13
Профессиональная щетка для вычесывания шерсти домашних животных, средство для удаления шерсти собак, расческа для щенков и кошек, принадлежности для груминга собак, средства от линьки.;5,0;2543;125;104
20 шт. галстуков-бабочек для собак, модные аксессуары для собак, галстуки-бабочки для маленьких собак и кошек, аксессуары для домашних животных, товары для собак.;4,8;51;217;90
5/10/30 рулонных пакетов для собачьих экскрементов, большие пакеты для кошачьих отходов, для уборки дома и улицы, многоразовые мусорные пакеты, товары для животных, 15 пакетов/рулон;4,8;40;500;142
Миска для кошек, аксессуары для домашних животных, керамическая, с диагональными высокими лапками, милая, для защиты шейного отдела позвоночника, миска для воды и питья для собак, товары для домашних животных.;5,0;26;333;931
Светоотражающая шлейка для собак, регулируемая, предотвращает рывки, дышащая шлейка для маленьких, средних и крупных собак. Товары для домашних животных.;5,0;2983;17;9
Аксессуары для собак Donut Mand: плюшевая лежанка для кошек и собак, круглый коврик XXL для маленьких и средних животных, успокаивающий, 100 см.;4,8;102362;1000;16114
Угловая щетка-расческа для домашних животных, игрушка для кошек, пластиковая когтеточка с щетиной, массажер для кошачьей дуги, когтеточка для самостоятельного ухода за шерстью.;4,6;138;600;1178
Аппликатор для таблеток для домашних животных, шприц для кошек и собак, кормушка для лекарств, средства от насекомых, зажим для банок с таблетками, поилка для кошек и собак.;4,7;26;227;237
Пакет для собачьих экскрементов, мешок для уборки экскрементов на открытом воздухе, принадлежности для уборки мусора с собаками, товары для домашних животных.;4,6;56;36;7
Теплые шумопоглощающие наушники для собак и кошек, тюрбан для ушей питомцев, успокаивающие эмоции, для поддержания чистоты ушей животных зимой. Товары для кошек.;4,5;87;186;367
Расчески-иглы для шерсти животных с нескользящей ручкой, щетки для удаления шерсти собак и кошек, расчески для завязывания узлов, принадлежности для груминга собак и кошек.;4,9;91;104;67
3 шт. Игрушка-дразнилка для кошек: палочка с радужной лентой, интерактивная палочка для кошек, для здоровых упражнений в помещении, забавная палочка для кошек, товары для домашних животных, игрушка для котят.;4,8;28;233;57
Теплое гнездо для крупных собак, собачье гнездо и товары для домашних животных, собачье гнездо для маленьких и средних собак, популярное в интернете гнездо для домашних животных, лежанка для собак, коврик для собак, коврик для собак, кошачье гнездо.;5,0;1560;45;28
1/10/30 рулонов с печатью пакетов для собачьих экскрементов, мешков для сбора отходов жизнедеятельности собак и кошек, чистых мешков для щенков, случайный цвет, товары для животных;4,8;49;137;15
