Наименование товара;Средний рейтинг;Остаток на складе;Продажи;В избранном
Сетчатая лопатка для удаления кошачьего наполнителя, принадлежности для уборки кошачьих экскрементов, большая лопатка для кошачьего наполнителя, тофу-наполнитель, кошачий лоток для кошачьего наполнителя;5,0;9993;5;0
Перезаряжаемая миниатюрная кнопка для общения с домашними животными: для кошек и собак, для записи разговоров, дрессировки, звонка.;5,0;1986;28;64
Охлаждающий коврик для собак, летняя подушка для щенков, мягкий нескользящий коврик для сна домашних животных, аксессуары для питомцев.;4,5;529;20;38
Автоматическая кормушка для домашних животных с активной RFID-технологией предотвращает кражу корма. Идеально подходит для диетического питания. Позволяет планировать приемы пищи.;4,7;10;0;1
Сменные плюшевые аксессуары для кошачьих игрушек: сменные головки для кошек, забавные палочки для кошек, игрушки для домашних животных, 5/10/6/11 шт.;4,9;102222;1000;418
Колокольчик для ключей в виде питомца, милый, разноцветный, 22 мм, рождественское украшение, очаровательный брелок, аксессуары для ключей, конфетные цвета, разноцветные колокольчики.;4,6;28;46;25
Супермягкая моющаяся лежанка для собак, подходящая для всех сезонов, универсальная, для глубокого сна, бархатный коврик, диван, лежанка для кошек, корзина для собак.;4,7;240;0;1
Плюшевые игрушки-динозавры для кошек и собак, интерактивные игрушки для жевания, мягкие игрушки для животных, игрушки для маленьких собак.;5,0;78;98;85
Игрушки для собак: летающий диск для дрессировки домашних животных, кольцо-дергатель, интерактивные плавающие игрушки против укусов, игрушки для собак, предотвращающие агрессивное жевание.;4,8;1903;1000;572
Паровая щетка-распылитель 3 в 1 для собак, электрический распылитель, щетка-расческа для кошек, массажер, средство для ухода за шерстью домашних животных, удаление спутанных и выпавших волос.;4,7;912;2000;1187
Нескользящий коврик для кошачьего туалета в подарок, водонепроницаемый двухслойный коврик для кошачьего туалета, коврик для кошачьего туалета с песком, подстилка для кошек, аксессуары для кошек.;4,8;275;445;901
Складная силиконовая миска для собак, дорожная миска для корма и воды для домашних животных, без бисфенола-А, складная чашка-миска с карабином.;4,9;69902;129;146
Набор чернил для создания отпечатков лап домашних животных (собак и кошек). Безопасный, нетоксичный, не пачкает руки и ноги. Легко моется. Сувенир для домашних животных.;4,7;918;500;411
Персонализированный ошейник с идентификационной биркой для питомца, с бесплатной гравировкой имени кошки, собаки или щенка, подвеска в виде золотой лапки с блестками, аксессуары для домашних животных, 3 см.;4,6;7883;69;93
Электрическая игрушка для кошек в виде рыбки, игрушки для домашних кошек, имитация рыбки-качелей, танцующая рыбка для котят, забавная игрушка-рыбка для кошек, принадлежности для жевания и игр, зарядка через USB.;4,7;244;2000;1694
Двусторонняя щетка для груминга из нержавеющей стали для собак и кошек, предназначенная для удаления линьки и колтунов, а также подшерстка. Легко распутывает узлы и колтуны.;4,8;449;1000;2464
Многоразовая пеленка для собак, впитывающий подгузник, моющаяся пеленка для приучения щенков к туалету, лежанка для животных, коврик для мочеиспускания, чехол на автомобильное сиденье, товары для животных.;4,7;3415;1000;2350
Светящийся светодиодный ошейник для собак, перезаряжаемый, водонепроницаемый, регулируемый, с подсветкой, ошейник-ночник для собак, защитное ожерелье для питомца.;4,6;122354;251;275
Деревянный держатель для капсул, современный гамак-подставка для кошек, лежанка для питомцев.;4,7;2;1;3
Дверца-откидная с 4-позиционным замком для безопасности собак и кошек, а также для котят и щенков, защитная дверца для мелких домашних животных, товары из АБС-пластика.;4,7;593;1;0
Одноразовые пакеты для уборки собачьих экскрементов, диспенсер для пакетов в форме косточки с зажимом для поводка, товары для щенков, 5 рулонов (75 шт.) пакетов.;4,8;2976;164;39
Игрушки для кошек, чистящие зубы, жевательные палочки Silvervine, лакомства для домашних животных, натуральные палочки с кошачьей мятой для котят, игрушки для дразнения с кошачьей мятой.;4,8;582;1000;552
Перчатки для массажа ванны, щетка для щенков и больших собак/кошек, мягкие защитные силиконовые аксессуары для домашних животных (собак и кошек), инструменты Mascotas Products.;4,8;507;3000;2568
Водонепроницаемый силиконовый коврик для домашних животных (собак и кошек), подстилка для корма, коврик для миски или поилки, подставка для кормления собак, легко моется.;4,8;59970;18;9
Паровая щетка для кошек, паровая щетка для собак, электрический распылитель 3 в 1, щетка для массажа шерсти кошек, расческа для груминга домашних животных, расческа для удаления шерсти.;4,8;145;70;103
2/3 шт. игрушки-узлы для собак и кошек, жевательные игрушки для собак в форме морковки, игрушки из хлопковой веревки для домашних собак, игрушки для кошек;4,7;191;8;4
Двусторонняя дверца для домашних животных (кошек и собак), обеспечивающая свободный доступ, подходит для установки на стеклянные и деревянные двери.;4,3;602;5;153
Диспенсер для мусорных пакетов, фонарик, держатель для собачьих экскрементов, принадлежности для сбора мусора, поводок для выгула собак на открытом воздухе.;4,7;16;2;5
Зимняя теплая мягкая лежанка-диван для собак, зимнее гнездо, корзинки для щенков, коврик, будка для крупных, средних и маленьких собак, аксессуары и принадлежности для животных.;4,0;21;23;946
Диспенсер для биоразлагаемых пакетов для собачьих экскрементов со светодиодной подсветкой, держатель для пакетов, набор пакетов для уборки за собаками и домашними животными. Аксессуары для уборки.;5,0;8;4;5
Электрошоковый ошейник для собак - тренировочный ошейник для собак (8-140 фунтов) с вибрацией, электрическим разрядом, звуковым сигналом, перезаряжаемый и водонепроницаемый.;5,0;39990;9;45
Мягкая игрушка для домашних животных в виде пентаграммы со звуковым эффектом. Игрушки для собак и кошек. Товары для животных.;4,9;327;134;61
Диспенсер для пакетов для собачьих экскрементов со светодиодной подсветкой, держатель для одноразовых мусорных пакетов для собак и кошек, аксессуары для уборки на открытом воздухе.;5,0;35;2;3
Автоматическая кормушка для кошек и собак, поилка с подставкой, двойная миска для кошек и собак.;3,7;3933;45;15
Автоматический поилка для кошек с интеллектуальной системой подачи воды и светодиодной подсветкой, заряжается через USB. Электрическая поилка для домашних животных.;4,7;39987;13;8
Кошачий домик-дерево высотой 51 дюйм с гамаком и когтеточкой.;4,7;6;9;42
Портативный многофункциональный мешок для дрессировки собак, сумка для путешествий на открытом воздухе, прочные аксессуары для домашних животных, мешочек для лакомств и уборки экскрементов для собак.;4,9;258;333;598
Игрушки для маленьких собак из резины, устойчивые к укусам, игрушки для чистки зубов, жевательные игрушки для дрессировки, товары для щенков.;4,6;59;349;159
Умная дверца-откидная дверь для собак и кошек с 4-позиционным замком, изготовлена ​​из ABS-пластика, управляется переключателем направления, размеры S/M/L/XL, 5 цветов.;4,7;2;0;12
Охлаждающий коврик для собак, летняя подстилка, лежанка для домашних животных, одеяло для кошек, диван, дышащий, летний, моющийся, аксессуары для домашних животных.;4,5;37;332;388
6  пищащих латексных мячиков-пищалок, резиновых игрушек-пищалок для собак маленьких пород, интерактивные товары для домашних животных, аксессуары для собак.;4,8;20;262;196
Мягкие плюшевые диваны-кровати для кошек и собак, моющиеся, теплые, уютные, для питомцев, для собак и кошек, утолщенные, удобные подушки для кошек, спальные места для собак, мебель для кошек.;4,7;4000;0;1
Управляемая дверца для входа и выхода для домашних животных, защитная дверца для кошек, принадлежности для домашних животных, размер S, коричневый.;4,7;9;0;0
Щетка 3-в-1 для шерсти собак, кошек, электрощетка для чистки шерсти домашних животных, щетка с паровым распылителем, массажная расческа для удаления шерсти, щетка против разлета шерсти.;4,7;18;500;202
1 шт. Игрушка-дразнилка с перьями для котят. Забавная красочная палочка-палочка для кошек. Деревянные игрушки для домашних животных. Интерактивная палочка для кошек. Товары для домашних животных.;4,8;266;448;1932
Забавные игрушки для собак с функцией записи, портативные говорящие игрушки для домашних животных, кнопки для общения с питомцами, милые товары для общения с животными.;4,8;516;2000;1802
120 рулонов пакетов для собачьих экскрементов, пакеты для уборки экскрементов на открытом воздухе, товары для домашних животных, 15 пакетов/рулон, сменные мусорные пакеты, товары для животных;4,7;269415;900;284
20 шт. вешалок для одежды для животных, пластиковые вешалки для одежды.;4,7;4;6;2
Интерактивная игрушка для кошек на дистанционном управлении, «умный» автомобиль, автоматическое движение, игрушка для кошек, которая поможет справиться со скукой. Веселая игрушка для кошек.;4,7;7970;9;16
Портативная складная миска для домашних животных, силиконовые кормушки с крючком для подвешивания, товары для животных, корм для собак и кошек.;4,7;1018;418;141
Тройная кормушка для кошек и собак, 2-в-1 миски с автоматической поилкой, наклонная и вращающаяся конструкция для кошек и собак.;4,6;38;320;444
Интерактивный мяч-игрушка для кошек, автоматический вращающийся на 360° самокатящийся мяч с USB-зарядкой, игрушка для тренировок и погони для кошек.;4,7;1189;3000;4249
Очень большая плюшевая будка для собак в виде ягненка с уютной лежанкой, мягким ковриком и съемной подушкой - популярный товар для домашних животных, лежанка для кошек.;4,7;1400;0;1
Складная силиконовая миска для собак и домашних животных объемом 350 мл, портативный контейнер для корма щенков для путешествий и отдыха на природе. Посуда для кормления домашних животных.;4,9;59192;600;235
Расческа для удаления шерсти собак и кошек. Расческа для ухода за шерстью домашних животных (длинная и короткая шерсть). Щетка для стрижки и распутывания колтунов. Инструменты для груминга собак и других домашних животных.;4,9;482;2000;663
Интерактивные игрушки для кошек в виде имитации птицы: электрический подвесной орел, летающая птица, игрушка-дразнилка для кошек, палочка для кошек, когтеточка, веревка для домашних животных.;4,3;74;2000;2681
Забавные игрушки для домашних животных, милые мультяшные плюшевые игрушки, устойчивые к укусам, жевательные игрушки для кошек и собак, интерактивные товары для домашних животных, помощник для питомца.;4,7;209;16;9
Большая квадратная плюшевая лежанка для кошек и собак, летняя моющаяся водонепроницаемая подстилка для кошек, подушка для животных, товары для средних и крупных собак.;4,4;234;1000;1331
Новые игрушки для кошек: милые плюшевые рыбки, имитация карася, подходят для домашних животных.;4,7;7999;1;0
Щетка для мытья собак (80 мл), массажная расческа для кошек, щетка для груминга и купания, мягкая силиконовая резина.;4,8;184;1000;1004
Игрушки для кошек, мятные рыбки, палочка для дразнения кошек, кошка Мого Леди Киттер, кукла для самоудовлетворения, марионетка, котенок, товары для домашних животных.;4,7;7997;1;1
Интерактивный мяч для кошек, умные игрушки для кошек и собак, электронная интерактивная игрушка для кошек, автоматический катящийся волшебный мяч для игр в помещении, аксессуары для кошек.;4,3;4475;10000;7463
Супермягкая зубная щетка-палец для домашних животных, щетка для собак, средство от неприятного запаха изо рта, зубного камня, для ухода за зубами, силиконовый гель для чистки зубов собак и кошек. Товары для животных.;4,8;10342;10000;6480
Игрушка для собак, завязывающаяся на хлопковой веревке, устойчивая к укусам, для маленьких собак и щенков, снимает заложенность носа, чистит зубы, игрушка для жевания.;4,3;102;1000;695
1 шт. Регулируемый ремень безопасности для собак и кошек в автомобиле, подходит для маленьких и средних собак. Товары для путешествий с домашними животными.;4,8;100;900;212
Расческа для удаления шерсти кошек, щетка для груминга собак, инструменты для вычесывания шерсти, триммер для вычесывания шерсти щенков, стрижка шерсти животных, расчески для удаления колтунов и вычесывания шерсти.;4,8;142;2000;700
DownyPaws 4000mAh — умный очиститель воздуха для кошачьего туалета, дезодорант для кошачьего туалета.;4,7;530;5000;14261
Ошейник против лая для домашних животных - Звуковой ошейник для собак - Ошейник для дрессировки собак - Товары для дрессировки домашних животных;4,7;989;1;1
Игрушки для собак из натурального каучука, жевательные игрушки для собак, мячик для чистки зубов, лакомство, сверхпрочный интерактивный эластичный мячик 5 см для товаров для животных.;4,7;183;117;20
Пакеты для собачьих экскрементов, пакеты для уборки экскрементов на открытом воздухе, товары для домашних животных, 15 пакетов/рулон, сменные мусорные пакеты, товары для животных.;4,7;1998;1;0
Паровая щетка для кошек и собак, массажная расческа с паровым распылением, средство для удаления шерсти 3 в 1, аксессуары для груминга домашних животных.;4,7;1938;4000;3458
Защитный ремень безопасности для собак в автомобиле, аксессуары для путешествий с домашними животными, поводок-ошейник для собак с отстегивающимся креплением, прочная автомобильная шлейка.;4,7;1158;10000;6097
Выпущен в 2023 году. Ультразвуковой отпугиватель для собак, устройство для дрессировки собак, перезаряжаемое, отпугивающее собак от лая, со светодиодным фонариком.;4,8;65;95;131
Новая популярная игрушка для собак: пищащая плюшевая игрушка для всех щенков, забавная, прочная, для жевания, милая игрушка для питомцев.;4,8;27;312;226
Биоразлагаемые пакеты для уборки собачьих экскрементов (15 пакетов/рулон) для щенков и кошек. Рулоны пакетов для уборки экскрементов на открытом воздухе.;4,8;8914;500;121
Складной туннель для кошек, товары для домашних животных, игровой туннель для кошек, дышащая игрушка для кошек, сверло для дома, громкая бумага;5,0;383;466;452
Игрушки для собак больших и маленьких размеров: интерактивные игрушки из хлопковой веревки, мини-игрушки для собак, мяч для собак, аксессуары для собак, зубная щетка, жевательная игрушка для щенков.;4,7;152;500;202
Игрушка для дрессировки кошек: плюшевая подушка в виде рыбки, 20 см, имитация рыбки, интерактивная игрушка-рыбка для кошек, товары для животных.;4,8;468;1000;544
Плюшевые игрушки-дразнилки для кошек, палочка-дразнилка для кошек, интерактивные игрушки для кошек, забавная ленточная палочка с колокольчиком, товары для кошек, аксессуары для кошек.;5,0;120;354;309
Домик-кровать для кошек, будка-гнездо, круглая спальная пещера для домашних животных, лежанки для котят, корзинка для питомцев, уютная подушка-шезлонг для котят, домик-палатка для кошек, домик для собак.;4,7;29740;304;263
Шлейка для собак, предотвращающая рывки, с 2 зажимами для поводка, регулируемый мягкий жилет с подкладкой, черная.;4,6;49;375;250
