Наименование товара;Средний рейтинг;Остаток на складе;Продажи;В избранном
Портативный пояс для фиксации домашних животных с регулируемыми D-образными кольцами, ремень для купания собак, шлейка для груминга, пояс для живота, набор для ухода за домашними животными.;4,7;327;362;460
Интерактивная игрушка-измеритель для кошек в виде спиральных пружин для котят, разноцветные пружины, игрушки для кошек и другие товары для животных.;4,9;141;2000;818
Супермягкая зубная щетка-палец для собак, средство для чистки зубов, предотвращает неприятный запах изо рта, изготовлена ​​из нетоксичного силикона. Принадлежности для чистки зубов собак и кошек.;4,9;106;66;43
Щетка для чистки домашних животных, перчатки для купания и массажа собак и кошек, расческа, инструмент для удаления шерсти, мягкая резиновая щетка для груминга, принадлежности для мытья животных.;5,0;997;132;33
10 шт. сменных фильтров для поилки для кошек. Фильтры для поилки для кошек.;4,8;46;1000;946
Милая пищащая игрушка в виде щенка, собаки или кошки, устойчивая к укусам, жевательная игрушка для маленьких собак, талисманы в форме животных, аксессуары для домашних животных.;4,6;10869;800;4802
Щетка для купания щенков и крупных домашних животных (собак и кошек) с массажным эффектом и мылом, мягкий безопасный силиконовый шампунь для собак и кошек, инструменты для чистки во время купания.;4,7;1101;131;358
Защелка для дверцы для кошек предотвращает проникновение собак. Регулируемый эластичный замок для ворот не пускает собак. Аксессуары для кошек и домашних животных.;4,8;296;238;175
Бесшумный ультразвуковой свисток для собак, чтобы остановить лай, медная тренировочная флейта для собак, средство для отучения от лая, товары для животных, звуковой тренировочный инструмент;4,4;147;395;131
Новые милые солнцезащитные очки в форме сердца для домашних животных, заколки для волос, бантики для собак, щенков, кошек, йоркширских терьеров, плюшевых мишек, украшения для шерсти домашних животных, товары для животных.;5,0;65;35;55
1 набор плюшевых игрушек в виде кошки: пистолет, пусковая установка, бесшумный интерактивный инструмент, мини-стрелялка, эластичные плюшевые мячики, товары для животных.;4,8;14;148;57
Пищащие игрушки для домашних животных, мячики для животных, резиновые мячики для жевания, игрушки для чистки зубов собак, игрушки для жевания для собак, устойчивые к укусам, товары для животных.;4,5;94;245;60
Мягкая игрушка-щенок «Сердцебиение» для дрессировки и обучения поведению, удобная для объятий, снимает тревогу и способствует засыпанию. Прочная, прямая доставка.;4,6;172;500;749
1 шт. Игрушка для кошек: палочка-перо с колокольчиком, игрушка для мышиной клетки, пластиковая искусственная разноцветная игрушка-дразнилка для кошек, товары для домашних животных, случайный цвет;4,8;136;413;724
Миска для кошачьего корма из нержавеющей стали, кормушка для котят и кошек, миска для воды с нескользящим резиновым основанием, маленькая миска для домашних животных, аксессуары для кошек, товары для животных.;3,7;60;40;27
Автоматическая кормушка для собак (12 л), 5G WiFi, для крупных пород собак, автоматическая кормушка для кошек, камера для домашних животных 1080P Full HD, дозатор лакомств и корма.;4,7;20;0;1
Автоматический мячик для собак и кошек, заряжаемый через USB. Гравитационный катящийся мячик для домашних животных. Автоматически движущийся и прыгающий мячик.;4,7;198;0;0
Палочка для чистки зубов собаки из пищевого силикона без бисфенола-А в форме кости, интерактивная, устойчивая к укусам, имитирующая собачьи зубы.;4,2;23;76;23
Милые оранжевые игрушки для собак в форме моркови и овощей, плюшевые, пищащие, с пищащим эффектом. Подарок для собаки.;4,8;379;68;30
Расческа от блох из нержавеющей стали, щетка для отпугивания насекомых, расчески для ухода за домашними животными, портативный инструмент для удаления шерсти, товары для кошек и собак.;4,9;27379;188;71
Миска для медленного кормления домашних животных, предотвращающая удушье, из полипропилена, тарелка для кормления собак, предотвращающая заглатывание пищи.;4,8;189;1000;1350
Игрушка-мячик для чистки зубов у маленьких собак и щенков, жевательные игрушки для прорезывания зубов, аксессуары для собак, милые веревочные игрушки для щенков, 1 шт.;4,8;146;384;567
Интерактивная игрушечная машинка для кошек, мячик-игрушка с автоматическим вращением и дистанционным управлением, аксессуары для кошек и котят, товары для дома.;4,8;220627;1000;1487
Имитация мышиного хвоста, игрушка-дразнилка для кошек, забавная палочка, длинный силиконовый хвост, интерактивные игрушки для кошек и котят, товары для охоты с животными.;4,8;189;1000;518
Бесконтактная палочка для кошек в виде птицы/пера с колокольчиком, мощная присоска, интерактивные игрушки для кошек и котят, товары для охоты и упражнений для домашних животных.;4,9;12280;2000;1515
Игрушки для кошек: прыгающие, ходящие, скачущие, мультяшные плюшевые цыплята, заводные котята, интерактивные игрушки, заводной цыпленок, товары для кошек.;4,7;1187;267;905
Щетка для собак и кошек, самоочищающаяся щетка для удаления шерсти животных, инструменты для груминга, расческа для распутывания шерсти, аксессуары для собак.;4,7;203;35;7
Дверца-откидная для собак и кошек с 4-сторонним замком безопасности. Дверца-откидная для маленьких домашних животных из АБС-пластика. Комплект дверцы-откидной двери для кошек и собак.;4,9;207;1000;9667
Игрушка для собак в виде палочки для кормления с имитацией звуков и зубов, устойчивая к укусам, пищащая игрушка-гусеница, имитирующая еду, износостойкая.;4,7;149;1;0
Поводок для собак из дышащей сетчатой ​​ткани, мягкая и удобная шлейка для щенков и кошек, жилет-ошейник, товары для домашних животных, таких как чихуахуа, мопс, бульдог.;4,6;427;2000;557
Светодиодный ошейник для собак с USB-зарядкой, защита от потери, ночник, светящееся ожерелье для собак, регулируемый нейлоновый светящийся ошейник для домашних животных.;4,7;15000;103;33
Фильтр с активированным углем для поилки для кошек и собак, круглый сменный фильтр 2 л, беспроводной диспенсер для воды с датчиком движения.;5,0;41;121;91
Товары для животных: ошейник для собак с пряжкой из сплава, цепочка для собак и кошек, регулируемый размер для маленьких и средних собак. Ошейники для собак.;4,7;237;490;543
Интерактивные игрушки для кошек, обучающие игрушки для кошек, креативные мини-помпоны для котят, игры, эластичные плюшевые мячики, товары для кошек, аксессуары для домашних животных.;4,7;633;10000;11388
VIP-ошейник для щенков, 68 см (37 см), для маленьких собак и кошек. Аксессуары и товары для домашних животных. Поставщики.;4,5;951;304;35
Перчатки-щетка для массажа и купания щенков, собак и кошек, мягкие защитные силиконовые аксессуары для домашних животных (собак и кошек), расческа для собак.;4,7;1299;298;245
Паровая щетка для кошек и собак, массажная расческа с паровым распылением, средство для удаления шерсти 3 в 1, аксессуары для груминга домашних животных.;4,9;2282;332;116
Симпатичный диспенсер для пакетов для уборки собачьих экскрементов, без самих пакетов и поводков, можно прикрепить к любому собачьему поводку — идеальный подарок на День святого Валентина.;4,8;231;600;295
Регулируемая шлейка для собак, светоотражающий защитный жилет для тренировок и прогулок, поводок-ошейник для французского бульдога, аксессуары для собак.;4,8;139054;1000;1792
Игрушечная машинка на дистанционном управлении, аксессуары для дома, товары для домашних животных, котята, умная игрушечная машинка для кошек, интерактивный мячик с автоматическим качением.;5,0;2382;31;14
Мягкие плюшевые игрушки-пищалки для щенков и кошек, подходящие для маленьких собак, чихуахуа и померанских шпицев. Подарок для питомцев Happy Time Pet Supplies.;4,8;11823;56;40
1 шт. Плюшевая игрушка для собак в виде авокадо, пищащая, прочная, для жевания, интерактивная игрушка.;5,0;13;49;33
Ограждение для собак, защитная сетка, складное ограждение для собак, ворота для собак, волшебные сетчатые ворота для животных, товары для животных.;5,0;69;16;11
Игрушки для собак, игрушка со звуком кричащей курицы, игрушка для щенков, устойчивая к укусам, жевательная игрушка, интерактивная пищащая игрушка для собак, аксессуары для щенков.;4,8;17;441;303
Щетка для удаления шерсти домашних животных, расческа для собак из нержавеющей стали, автоматическая расческа для кошек, принадлежности для ухода за шерстью домашних животных.;4,7;600;900;1284
"Переносная клетка для собак, мягкая дорожная клетка для щенков, 32""x 23""x 23"", складная клетка для домашних животных.";4,7;20;0;9
Палочка для чистки зубов собак, изготовленная из пищевого материала, в форме кости, интерактивная, устойчивая к укусам, подходит для маленьких питомцев с небольшой силой укуса.;4,3;437;1000;587
Поводок для собак 3-5 м для маленьких собак и кошек, автоматический выдвижной, нейлоновый, для прогулок и бега, для чихуахуа, йоркширские товары для животных;4,7;26;416;150
Ошейник от блох и клещей для собак (2/3 шт.), защита от паразитов, 8 месяцев, регулируемый ошейник для крупных собак, щенков, кошек и других животных. Аксессуар для собак.;5,0;662;44;28
Плюшевый мишка, издающий звуки, интерактивная игрушка для собак, игрушка для чистки зубов, защита от укусов, игрушка-мишка Abreact, товары для домашних животных.;4,5;207;900;411
Интерактивная игрушка для кошек с USB-подключением: интеллектуальный шарик-каталка из силикона, автоматически вращающийся, в виде хвостика мыши, для котят.;4,5;128;500;633
Интерактивные игрушки для собак: летающие диски для дрессировки щенков, кольца, устойчивые к укусам, плавающая игрушка для фрисби.;4,5;42;43;11
Новое треугольное гнездо для кошек, закрытый домик для кошек, теплое и утолщенное гнездо для глубокого сна, гнездо для собак, товары для домашних животных.;4,7;86;490;735
Треугольная подвесная дверная мышка на зажиме, забавная игрушка для кошек, качающаяся мышка, забавная подвесная палочка для кошек, эластичные игрушки для кошек, товары для домашних животных;4,7;17471;0;0
Мягкая плюшевая мышка для кошек, мышонок с длинным хвостом, забавная игрушка для котят, игра для дрессировки кошек, товары для кошек.;4,7;148;174;79
Мягкая мебель для клетки для собак, большая деревянная клетка для собак, домик для собаки в помещении, приставной столик, увеличенного размера, длина 43,3 дюйма, темно-серый.;4,7;4000;0;0
1/2/3 шт. Игрушки для кошек, случайный цвет, палочка, перо, игрушка для кошек с маленьким колокольчиком, интерактивные игрушки для котят и кошек, товары для кошек и домашних животных.;4,4;448;26;10
Игрушка для домашних животных из трех частей: костяной шип, интерактивный звук «громовой мяч», игрушка, устойчивая к скрежету зубов и укусам.;4,7;200;0;0
Миска для кошек с милым мультяшным рисунком, керамическая миска для питья и кормления кошек и собак. Аксессуары для кошек и собак.;4,8;5;171;3969
Подстилка для корма для домашних животных, коврик для миски для собак, коврик для миски для кошек, водонепроницаемый коврик для кормления щенков, предотвращающий перелив еды и воды, силиконовый коврик для животных.;4,9;46;321;583
Щетка для собак и кошек, самоочищающаяся щетка для удаления шерсти животных, инструменты для груминга, расческа для распутывания шерсти, аксессуары для собак.;4,7;1502;421;1126
10 шт. бантиков в форме цветка для ухода за шерстью собак, маленькие бантики для шерсти кошек и собак, аксессуары для шерсти животных, товары для животных;5,0;28;25;16
Кликер для дрессировки собак и кошек с ремешком на запястье. Принадлежности для дрессировки собак и кошек. Кликер для дрессировки домашних животных. Товары для собак. Дрессировка собак.;4,9;51;60;9
Мягкий коврик-корзина для собак из полипропиленового хлопка, универсальная водонепроницаемая лежанка для кошек и собак, большая лежанка для домашних животных, теплая и удобная собачья будка.;4,0;796;4;2
Щетка для удаления шерсти собак, расческа для ухода за шерстью кошек (длинная шерсть), щетка для чистки и купания домашних животных.;5,0;6326;22;2
Кровать для кошек, матрас для домашних животных, теплая мягкая плюшевая лежанка с чехлом, круглое спальное гнездо для кошек и собак, для маленьких собак и котят.;4,8;524;209;352
Коврик для кошек из ротанга, плетеный коврик для сна, диван-кровать, летний охлаждающий коврик для маленьких собак, кошек, котят и щенков, подушка для лежанки.;5,0;897;3;11
Сенсорные мячи для домашних животных, текстурированные мячи для прикосновений к рукам, мягкие массажные мячи, товары для животных, аксессуары для собак, игрушка, защищающая собак от укусов.;4,4;78;700;800
Универсальное плетеное кошачье гнездо Four Seasons ручной работы из натуральной лозы, сезонный утеплитель, съемный, моющийся, зимние аксессуары для домашних животных.;4,5;162;33;165
Комплект клетки для собак маленьких размеров для использования в помещении с чехлом.;4,7;18;2;0
100/50/40/20 шт. Впитывающие подгузники для собак, одноразовые пеленки для дрессировки щенков, быстросохнущие коврики, чистящие подушки, товары для собак;4,6;359;600;396
Миска из нержавеющей стали для собак и кошек, объемом 200-1600 мл, с нескользящим покрытием, для корма, воды и еды, для щенков и котят. Товары для домашних животных.;4,9;43;38;49
Маленькая подушка для животных, мягкая универсальная подушка для кошек и собак, U-образная игрушка для шейных позвонков.;4,7;11;4;1
Прочный поводок для собак (3-5 м) для маленьких и средних собак, нейлоновый, гибкий, яркого цвета, для французских бульдогов. Товары для животных.;4,5;106;13;2
Лопатка для кошачьего наполнителя из нержавеющей стали, прочный совок для уборки отходов жизнедеятельности домашних животных, включая ящериц, котят и собак. Инструмент для быстрой уборки.;4,7;22;6;0
1 шт. Прочная и нескользящая тарелка для медленного кормления собак, пластиковая, предотвращающая удушение, миска для еды, товары для домашних животных.;4,7;28;12;10
1 шт. Мягкая плюшевая теплая лежанка-коврик для собак и кошек, вольер-корзина для сна для маленьких собак.;5,0;45;19;12
Расческа-щетка Bonve для удаления шерсти животных, подходит для собак и кошек с короткой и средней длиной шерсти, а также для ухода за шерстью. Инструмент для вычесывания шерсти.;4,6;200;69;32
Силиконовая поясная сумка для дрессировки собак, портативная сумка для хранения лакомств и угощений для щенков с магнитной застежкой, принадлежности для прогулок с питомцем.;4,7;39;1;0
Универсальный кликер для дрессировки собак, свисток с ответами, вспомогательное руководство для дрессировщика собак с брелоком, товары для собак и щенков.;4,7;32;14;93
Охлаждающий коврик для домашних животных: для собак и кошек, охлаждающий шелковый матрас, влагостойкая подушка-матрас для летних мелких животных, 5 размеров.;4,5;149;489;354
Поилка для домашних животных, кормушка, миска для воды для кошек, двойная миска, пластиковая автоматическая поилка, миска для собак, товары для животных.;4,8;35;150;100
